{
  "$schema": "https://json-schema.org/draft/2020-12/schema",
  "$id": "docs/schemas/qa-pilot-qualification-record.schema.json",
  "title": "QA Pilot Qualification Record",
  "description": "A governed qualification record for QA Pilot artifacts, processes, or reviewer actions. Records are advisory-only and evidence-grounded. Every qualification result must be traceable to source evidence. Qualification Records inherit evidence lineage — no independent evidence chain.",
  "type": "object",
  "required": [
    "record_id",
    "qualification_type",
    "target_id",
    "target_type",
    "qualification_level",
    "evidence_refs",
    "assessed_at",
    "assessed_by",
    "advisory_only",
    "custody",
    "librarian_impact"
  ],
  "properties": {
    "record_id": {
      "type": "string",
      "pattern": "^QR-[A-Z0-9]{4,12}-[0-9]{4}$",
      "description": "Unique qualification record identifier"
    },
    "qualification_type": {
      "type": "string",
      "enum": ["artifact", "process", "reviewer"],
      "description": "Dimension of qualification"
    },
    "target_id": {
      "type": "string",
      "description": "Identifier of the qualified target"
    },
    "target_type": {
      "type": "string",
      "enum": [
        "workbench_item", "evidence_packet", "test_case", "result_packet",
        "epic_suite", "checklist", "review_packet", "decision_packet",
        "sprint", "startup_surface", "registry_entry", "custody_receipt",
        "pipeline_layer", "export_packet", "action_packet", "handoff_packet",
        "review_outcome", "readiness_posture"
      ],
      "description": "Type of target being qualified"
    },
    "qualification_level": {
      "type": "string",
      "enum": ["unqualified", "spot_checked", "peer_reviewed", "audited", "exempt"],
      "description": "Qualification level achieved"
    },
    "qualification_criteria": {
      "type": "object",
      "properties": {
        "required_level": {
          "type": "string",
          "enum": ["unqualified", "spot_checked", "peer_reviewed", "audited", "exempt"]
        },
        "pass_rate_threshold": {
          "type": "number",
          "minimum": 0.0,
          "maximum": 1.0
        },
        "evidence_count_min": {
          "type": "integer",
          "minimum": 0
        },
        "authority_check_required": {
          "type": "boolean"
        }
      }
    },
    "evidence_refs": {
      "type": "array",
      "minItems": 1,
      "items": {
        "type": "object",
        "required": ["evidence_id", "evidence_type", "evidence_source", "verification_status"],
        "properties": {
          "evidence_id": { "type": "string" },
          "evidence_type": {
            "type": "string",
            "enum": [
              "receipt", "validation_result", "test_result", "custody_audit",
              "drift_check", "pipeline_health", "registry_state", "snapshot_baseline",
              "owner_decision", "review_outcome", "advisory_packet", "export_packet",
              "workbench_item", "evidence_packet", "checklist_result", "linker_result",
              "result_packet"
            ]
          },
          "evidence_source": { "type": "string" },
          "verification_status": {
            "type": "string",
            "enum": ["verified", "stale", "missing", "corrupted"]
          },
          "verified_at": { "type": "string", "format": "date-time" }
        }
      }
    },
    "sub_dimension_scores": {
      "type": "object",
      "additionalProperties": { "type": "number", "minimum": 0.0, "maximum": 1.0 }
    },
    "overall_score": {
      "type": "number",
      "minimum": 0.0,
      "maximum": 1.0
    },
    "lifecycle_state": {
      "type": "string",
      "enum": ["proposed", "in_progress", "completed", "expired", "superseded", "revoked"]
    },
    "provenance": {
      "type": "object",
      "required": ["assessor_id", "session_id", "tool_call_log"],
      "properties": {
        "assessor_id": { "type": "string" },
        "session_id": { "type": "string" },
        "tool_call_log": { "type": "string" }
      }
    },
    "expiry_date": {
      "type": "string",
      "format": "date"
    },
    "superseded_by": {
      "type": "string"
    },
    "notes": {
      "type": "string"
    },
    "advisory_only": {
      "type": "boolean",
      "const": true,
      "description": "Must always be true — qualification records never authorize work"
    },
    "custody": {
      "type": "string",
      "const": "qa-pilot-local",
      "description": "Must always be qa-pilot-local"
    },
    "librarian_impact": {
      "type": "string",
      "const": "none",
      "description": "Must always be none"
    },
    "assessed_at": {
      "type": "string",
      "format": "date-time"
    },
    "assessed_by": {
      "type": "string"
    }
  },
  "allOf": [
    {
      "if": { "properties": { "qualification_type": { "const": "artifact" } } },
      "then": { "required": ["overall_score", "sub_dimension_scores"] }
    },
    {
      "if": { "properties": { "qualification_type": { "const": "process" } } },
      "then": { "required": ["lifecycle_state", "provenance"] }
    },
    {
      "if": { "properties": { "qualification_type": { "const": "reviewer" } } },
      "then": { "required": ["provenance", "evidence_refs"] }
    }
  ]
}
