{
  "record_id": "QR-UNQUAL-0001",
  "qualification_type": "artifact",
  "target_id": "UNVERIFIED-ITEM-001",
  "target_type": "workbench_item",
  "qualification_level": "unqualified",
  "qualification_criteria": {
    "required_level": "spot_checked",
    "pass_rate_threshold": 0.80,
    "evidence_count_min": 1,
    "authority_check_required": false
  },
  "evidence_refs": [
    {
      "evidence_id": "NOTE-20260716-001",
      "evidence_type": "receipt",
      "evidence_source": "docs/examples/qa-pilot-qualification/valid/unqualified-no-evidence.json",
      "verification_status": "missing",
      "verified_at": "2026-07-16T12:00:00Z"
    }
  ],
  "overall_score": 0.0,
  "sub_dimension_scores": {
    "schema_compliance": 1.0,
    "evidence_freshness": 0.0,
    "evidence_diversity": 0.0,
    "authority_boundary": 1.0,
    "provenance_quality": 1.0
  },
  "lifecycle_state": "completed",
  "provenance": {
    "assessor_id": "OpenWork-DeepSeek-V4-Flash",
    "session_id": "qual-schema-1-session",
    "tool_call_log": "validate-qa-pilot-qualification.py fixture mode"
  },
  "notes": "Unqualified: no verified evidence exists for this target. Default state for unverified items.",
  "advisory_only": true,
  "custody": "qa-pilot-local",
  "librarian_impact": "none",
  "assessed_at": "2026-07-16T12:00:00Z",
  "assessed_by": "OpenWork (DeepSeek V4 Flash)"
}
